[
  {
    "schemaVersion": "runner.data.v1",
    "artifactId": "normalized-nfl-schedule",
    "kind": "schedule",
    "runnerEventId": "FIXTURE:NFL:AWAY:HOME",
    "sport": "NFL",
    "league": "NFL",
    "source": "Synthetic example authored in this repository; no provider retrieval.",
    "provider": "runner-fixture",
    "retrievedAt": "2026-09-26T17:45:00Z",
    "eventStartTime": null,
    "transformVersion": "runner-operations-v1",
    "freshness": "FIXTURE",
    "confidence": "UNKNOWN",
    "redistribution": "PUBLIC",
    "intelligence": {
      "classification": "UNKNOWN",
      "modelProbability": null,
      "marketProbability": null,
      "fairPrice": null,
      "executablePrice": null,
      "edge": null
    },
    "payload": {
      "note": "Normalized fixture example; canonical real event mapping has not been supplied."
    }
  }
]
